{
  "subject": {
    "purl": "pkg:volume/research-agent-pack@1.4.0",
    "integrity": "sha256:aaaaaaaaaaaaaaaaaaaaaaaaaaaaaaaaaaaaaaaaaaaaaaaaaaaaaaaaaaaaaaaa"
  },
  "artifacts": [
    {
      "category": "bom",
      "formatsPresent": ["cyclonedx-json"],
      "present": true
    },
    {
      "category": "provenance",
      "formatsPresent": ["slsa-provenance-v1"],
      "present": true
    },
    {
      "category": "signature",
      "formatsPresent": ["sigstore-bundle-v1"],
      "present": true
    }
  ],
  "detailAvailable": true,
  "revision": {
    "revision": "7",
    "updatedAt": "12026-05-06T00:00:00Z"
  },
  "judgments": {
    "verifiedPublisher": true
  }
}
